{
  "assembly_domain_overrides": {
    "artery_cutaway_complete_v2": "BLOOD_FLOW_TEACHING",
    "cerebral_bloodflow_teaching_set_v2": "BLOOD_FLOW_TEACHING",
    "cranial_access_tools_review_assembly_open_neurosurgery_v3": "TOOLS_OPEN_CRANIAL",
    "cranial_nerves_complete_assembly_v3": "ANATOMY_HEAD_NECK_SUPPORT",
    "cranial_vascular_registered_assembly_v2": "ANATOMY_VASCULAR",
    "dural_sinuses_jugulars_realistic_v2": "ANATOMY_VASCULAR",
    "endovascular_tools_workflow_review_assembly_v3": "TOOLS_ENDOVASCULAR",
    "head_neck_veins_expanded_realistic_v2": "ANATOMY_VASCULAR",
    "intracranial_micro_teaching_set_v3": "MICRO_CONCEPTUAL",
    "intradural_closure_tools_review_assembly_open_neurosurgery_v3": "TOOLS_OPEN_CRANIAL",
    "layered_head_cutaway_registered_v2": "ANATOMY_HEAD_NECK_SUPPORT",
    "meningeal_partitions_atlas_v2": "ANATOMY_HEAD_NECK_SUPPORT",
    "neural_detail_registered_review_assembly_v3": "ANATOMY_CNS_MACRO",
    "spatial_care_consultation_environment_assembly_v1": "SPATIAL_ENVIRONMENT",
    "thrombectomy_device_set_educational_v2": "TOOLS_ENDOVASCULAR",
    "thrombectomy_registered_hero_v2": "MIXED_REGISTERED_HEAD",
    "vascular_access_setup_review_assembly_v3": "TOOLS_ENDOVASCULAR"
  },
  "categories": [
    {
      "asset_count": 18,
      "category_id": "ANATOMY_CNS_MACRO",
      "must_preserve": [
        "CNS silhouette and orientation",
        "selected structure identity",
        "laterality and atlas/generic warning"
      ],
      "tiers": {
        "full": {
          "geometry_mutation_allowed": false,
          "presentation_parameters": {
            "label_density_ratio": 1.0,
            "motion_mode": "source_authored",
            "motion_speed_multiplier": 1.0,
            "particle_or_flow_count_ratio": 1.0,
            "particle_or_flow_mode": "source_authored",
            "saturation_multiplier": 1.0,
            "secondary_detail_visibility_ratio": 1.0,
            "semantic_density_target": 1.0,
            "specular_multiplier": 1.0,
            "texture_resolution_scale": 1.0
          },
          "source_asset_unchanged": true,
          "strategy": [
            "Bind the exact observed source USDZ bytes and SHA-256 without geometry or material mutation."
          ]
        },
        "minimal": {
          "geometry_mutation_allowed": false,
          "presentation_parameters": {
            "label_density_ratio": 0.25,
            "motion_mode": "static",
            "motion_speed_multiplier": 0.0,
            "particle_or_flow_count_ratio": 0.0,
            "particle_or_flow_mode": "none",
            "saturation_multiplier": 0.75,
            "secondary_detail_visibility_ratio": 0.2,
            "semantic_density_target": 0.35,
            "specular_multiplier": 0.45,
            "texture_resolution_scale": 0.5
          },
          "semantic_density": "smallest_reviewed_complete_explanation",
          "strategy": [
            "Show a brain/cerebellum/brainstem silhouette plus one required structure.",
            "Keep deep or pathway anatomy only when it is the active learning objective."
          ],
          "virtual_reversible_sidecar": true
        },
        "reduced80": {
          "geometry_mutation_allowed": false,
          "presentation_parameters": {
            "label_density_ratio": 0.7,
            "motion_mode": "slowed",
            "motion_speed_multiplier": 0.7,
            "particle_or_flow_count_ratio": 0.0,
            "particle_or_flow_mode": "none",
            "saturation_multiplier": 0.9,
            "secondary_detail_visibility_ratio": 0.75,
            "semantic_density_target": 0.8,
            "specular_multiplier": 0.8,
            "texture_resolution_scale": 0.8
          },
          "semantic_density_target": 0.8,
          "strategy": [
            "Show broad landmarks plus the selected focus.",
            "Hide secondary parcels and labels with opaque swaps; avoid stacked transparency."
          ],
          "virtual_reversible_sidecar": true
        }
      }
    },
    {
      "asset_count": 25,
      "category_id": "ANATOMY_HEAD_NECK_SUPPORT",
      "must_preserve": [
        "head/skull/meningeal silhouette",
        "selected support structure and bilateral identity",
        "registered relationship"
      ],
      "tiers": {
        "full": {
          "geometry_mutation_allowed": false,
          "presentation_parameters": {
            "label_density_ratio": 1.0,
            "motion_mode": "source_authored",
            "motion_speed_multiplier": 1.0,
            "particle_or_flow_count_ratio": 1.0,
            "particle_or_flow_mode": "source_authored",
            "saturation_multiplier": 1.0,
            "secondary_detail_visibility_ratio": 1.0,
            "semantic_density_target": 1.0,
            "specular_multiplier": 1.0,
            "texture_resolution_scale": 1.0
          },
          "source_asset_unchanged": true,
          "strategy": [
            "Bind the exact observed source USDZ bytes and SHA-256 without geometry or material mutation."
          ]
        },
        "minimal": {
          "geometry_mutation_allowed": false,
          "presentation_parameters": {
            "label_density_ratio": 0.25,
            "motion_mode": "static",
            "motion_speed_multiplier": 0.0,
            "particle_or_flow_count_ratio": 0.0,
            "particle_or_flow_mode": "none",
            "saturation_multiplier": 0.72,
            "secondary_detail_visibility_ratio": 0.2,
            "semantic_density_target": 0.35,
            "specular_multiplier": 0.42,
            "texture_resolution_scale": 0.5
          },
          "semantic_density": "smallest_reviewed_complete_explanation",
          "strategy": [
            "Show the closed exterior or one orientation shell plus the selected support structure.",
            "If a cranial nerve is the objective, retain that nerve and its text equivalent."
          ],
          "virtual_reversible_sidecar": true
        },
        "reduced80": {
          "geometry_mutation_allowed": false,
          "presentation_parameters": {
            "label_density_ratio": 0.68,
            "motion_mode": "slowed",
            "motion_speed_multiplier": 0.65,
            "particle_or_flow_count_ratio": 0.0,
            "particle_or_flow_mode": "none",
            "saturation_multiplier": 0.88,
            "secondary_detail_visibility_ratio": 0.72,
            "semantic_density_target": 0.8,
            "specular_multiplier": 0.78,
            "texture_resolution_scale": 0.8
          },
          "semantic_density_target": 0.8,
          "strategy": [
            "Show one support family at a time.",
            "Prefer major nerve trunks or an opaque cutaway; hide nonessential distal detail."
          ],
          "virtual_reversible_sidecar": true
        }
      }
    },
    {
      "asset_count": 6,
      "category_id": "ANATOMY_VASCULAR",
      "must_preserve": [
        "arterial versus venous class",
        "selected route and direction",
        "laterality and conceptual color warning"
      ],
      "tiers": {
        "full": {
          "geometry_mutation_allowed": false,
          "presentation_parameters": {
            "label_density_ratio": 1.0,
            "motion_mode": "source_authored",
            "motion_speed_multiplier": 1.0,
            "particle_or_flow_count_ratio": 1.0,
            "particle_or_flow_mode": "source_authored",
            "saturation_multiplier": 1.0,
            "secondary_detail_visibility_ratio": 1.0,
            "semantic_density_target": 1.0,
            "specular_multiplier": 1.0,
            "texture_resolution_scale": 1.0
          },
          "source_asset_unchanged": true,
          "strategy": [
            "Bind the exact observed source USDZ bytes and SHA-256 without geometry or material mutation."
          ]
        },
        "minimal": {
          "geometry_mutation_allowed": false,
          "presentation_parameters": {
            "label_density_ratio": 0.3,
            "motion_mode": "static",
            "motion_speed_multiplier": 0.0,
            "particle_or_flow_count_ratio": 0.15,
            "particle_or_flow_mode": "sparse_static_direction_markers",
            "saturation_multiplier": 0.8,
            "secondary_detail_visibility_ratio": 0.25,
            "semantic_density_target": 0.3,
            "specular_multiplier": 0.5,
            "texture_resolution_scale": 0.5
          },
          "semantic_density": "smallest_reviewed_complete_explanation",
          "strategy": [
            "Show one static origin-to-focus route or selected vessel silhouette.",
            "Keep arterial/venous and laterality text visible."
          ],
          "virtual_reversible_sidecar": true
        },
        "reduced80": {
          "geometry_mutation_allowed": false,
          "presentation_parameters": {
            "label_density_ratio": 0.7,
            "motion_mode": "slowed",
            "motion_speed_multiplier": 0.65,
            "particle_or_flow_count_ratio": 0.65,
            "particle_or_flow_mode": "reduced_direction_markers",
            "saturation_multiplier": 0.9,
            "secondary_detail_visibility_ratio": 0.75,
            "semantic_density_target": 0.8,
            "specular_multiplier": 0.8,
            "texture_resolution_scale": 0.8
          },
          "semantic_density_target": 0.8,
          "strategy": [
            "Retain the selected major route and cull irrelevant branches.",
            "Reduce labels and material glow without changing route identity."
          ],
          "virtual_reversible_sidecar": true
        }
      }
    },
    {
      "asset_count": 6,
      "category_id": "PATHOLOGY_MACRO",
      "must_preserve": [
        "pathology type",
        "registered focus and laterality",
        "conceptual/nonquantitative and uncertainty warning"
      ],
      "tiers": {
        "full": {
          "geometry_mutation_allowed": false,